{
  "$schema": "../target.schema.json",
  "id": "claude-code-cloud",
  "name": "Claude Code on the web",
  "description": "A Claude Code cloud session: an ephemeral container in an Anthropic-hosted environment, reached from claude.ai/code, the apps or the CLI. GitHub traffic goes through a dedicated proxy, everything else through an agent proxy with the environment's allow list.",
  "detect": "CLAUDE_CODE_REMOTE=true",
  "checked": "2026-10-31",
  "sources": [
    "https://code.claude.com/docs/en/cloud-environments",
    "https://code.claude.com/docs/en/claude-code-on-the-web",
    "https://code.claude.com/docs/en/plugins/loading",
    "https://code.claude.com/docs/en/hooks"
  ],
  "layout": {
    "skills": [
      ".claude/skills/{name}/SKILL.md"
    ],
    "agents": [
      ".claude/agents/{name}.md"
    ],
    "commands": [
      ".claude/commands/{name}.md"
    ],
    "plugin_dirs": [
      ".claude/skills/{plugin}"
    ]
  },
  "rules": [
    {
      "id": "committed-components",
      "summary": "The plugin's skills, agents and commands are committed under .claude/, which a cloud session loads from the clone with no install step.",
      "match": {
        "kind": "delivery",
        "when": {
          "vendored": "components"
        }
      },
      "severity": "info",
      "remedy": "Keep the committed copy in step with the plugin. This route carries only skills, agents and commands: the plugin's hooks and MCP and LSP servers do not come with them, and ${CLAUDE_PLUGIN_ROOT} is not set for a skill that belongs to no plugin (see vendored-parts-not-loaded and vendored-plugin-root-unset).",
      "fix_in": "repository",
      "sources": [
        "https://code.claude.com/docs/en/plugins/loading#plugins-shared-through-a-repository",
        "https://code.claude.com/docs/en/claude-code-on-the-web#manage-context"
      ],
      "basis": "docs",
      "checked": "2026-11-01"
    },
    {
      "id": "committed-plugin-dir",
      "summary": "The whole plugin, manifest and every component, is committed as .claude/skills/<plugin>/. A plugin placed there is a repository plugin, which loads only after the same trust check that applies to project allow rules; whether a cloud session, which never shows the workspace trust dialog, passes that check is not documented.",
      "match": {
        "kind": "delivery",
        "when": {
          "vendored": "plugin_dir"
        }
      },
      "severity": "needs-setup",
      "remedy": "Start a cloud session and check that the plugin's skills are offered; record the result here as basis: observed. If they are not, deliver it from the environment's setup script, which writes it into user settings.",
      "fix_in": "environment",
      "sources": [
        "https://code.claude.com/docs/en/plugins/loading#plugins-shared-through-a-repository",
        "https://code.claude.com/docs/en/plugins/loading#trust-check-and-component-limits-for-repository-plugins",
        "https://code.claude.com/docs/en/cloud-environments#what-carries-over-from-your-setup"
      ],
      "basis": "unconfirmed",
      "notes": "A cloud session applies the repository's .claude/settings.json permission rules, which pass the same trust check, yet it does not add the marketplaces that file lists, because that needs the trust dialog. The pages leave this route open.",
      "checked": "2026-11-01"
    },
    {
      "id": "repository-settings-ignored",
      "summary": "The repository declares the plugin in .claude/settings.json, and a cloud session ignores that file's enabledPlugins and extraKnownMarketplaces: adding a marketplace a repository declares needs the workspace trust dialog, which a cloud session never shows.",
      "match": {
        "kind": "delivery",
        "when": {
          "all": [
            {
              "declared_in": ".claude/settings.json"
            },
            {
              "not": {
                "vendored": true
              }
            }
          ]
        }
      },
      "severity": "needs-setup",
      "remedy": "Declare the marketplace and plugin in the session's user settings from the environment's setup script, which runs before Claude Code starts (this repository's .claude/hooks/install-plugins.sh does exactly that: `bash <checkout>/.claude/hooks/install-plugins.sh <checkout>`), or turn the plugin on in the organization's server-managed settings, or commit its components under .claude/. Plugins are fixed when Claude Code starts, so a SessionStart hook that declares them is too late for its own session: they appear only after /reload-plugins or in the next session.",
      "fix_in": "environment",
      "sources": [
        "https://code.claude.com/docs/en/cloud-environments#what-carries-over-from-your-setup",
        "https://code.claude.com/docs/en/plugins/loading#plugins-shared-through-a-repository",
        "https://github.com/z5labs/devex/issues/469",
        "https://github.com/z5labs/devex/pull/470"
      ],
      "basis": "observed",
      "observed": [
        {
          "url": "https://github.com/z5labs/devex/issues/469",
          "date": "2026-10-24",
          "result": "In a cloud session (Claude Code 2.1.310) on this repository, whose .claude/settings.json declares the z5labs-devex marketplace and enables backlog and daggerverse, installed_plugins.json was empty and none of their skills was offered."
        },
        {
          "url": "https://github.com/z5labs/devex/pull/470",
          "date": "2026-10-24",
          "result": "User settings holding only the directory marketplace and enabledPlugins loaded every plugin at startup, although the docs say a cloud session does not read user settings; observed outranks docs, so the user-settings route in the remedy works. A SessionStart hook that installed the plugins loaded none of them in its own session, only in the next one or after /reload-plugins."
        }
      ],
      "notes": "The docs' row 'Plugins enabled only in your user settings: No' is about the settings file on your own machine, which never reaches the VM. #470 is about user settings written inside the VM.",
      "checked": "2026-10-31"
    },
    {
      "id": "plugin-not-delivered",
      "summary": "Nothing in the repository delivers the plugin to a cloud session: it is neither declared in .claude/settings.json nor committed under .claude/.",
      "match": {
        "kind": "delivery",
        "when": {
          "all": [
            {
              "not": {
                "declared_in": ".claude/settings.json"
              }
            },
            {
              "not": {
                "vendored": true
              }
            }
          ]
        }
      },
      "severity": "needs-setup",
      "remedy": "Deliver it by one of the routes that load a plugin in a cloud session: the organization's server-managed settings, the environment's setup script writing the marketplace and plugin into user settings before Claude Code starts, or the plugin's components committed under .claude/ (skills in .claude/skills, agents in .claude/agents, or the whole plugin as .claude/skills/<plugin>/). Declaring it only in .claude/settings.json is not enough.",
      "fix_in": "environment",
      "sources": [
        "https://code.claude.com/docs/en/cloud-environments#what-carries-over-from-your-setup",
        "https://code.claude.com/docs/en/plugins/loading#plugins-shared-through-a-repository"
      ],
      "basis": "docs",
      "checked": "2026-10-31"
    },
    {
      "id": "vendored-parts-not-loaded",
      "summary": "The repository delivers the plugin by committing its skills, agents and commands under .claude/, and that does not carry this component: a cloud session reads hooks from settings files and MCP servers from .mcp.json, not from a plugin directory that is not loaded as a plugin.",
      "match": {
        "kind": "vendored",
        "via": "components",
        "types": [
          "hook",
          "mcp",
          "lsp"
        ]
      },
      "severity": "needs-setup",
      "remedy": "Commit the hooks into the repository's .claude/settings.json and the MCP servers into .mcp.json at its root, with paths that do not use ${CLAUDE_PLUGIN_ROOT}, or deliver the plugin as a plugin from the environment's setup script.",
      "fix_in": "repository",
      "sources": [
        "https://code.claude.com/docs/en/plugins/loading#plugins-shared-through-a-repository",
        "https://code.claude.com/docs/en/hooks",
        "https://code.claude.com/docs/en/mcp"
      ],
      "basis": "docs",
      "checked": "2026-11-01"
    },
    {
      "id": "vendored-plugin-root-unset",
      "summary": "A committed skill, agent or command runs a path under ${CLAUDE_PLUGIN_ROOT}. That variable is the directory of the plugin a component belongs to; a skill loaded from .claude/skills belongs to none, so the path collapses to /scripts/….",
      "match": {
        "kind": "vendored",
        "via": "components",
        "pattern": "CLAUDE_PLUGIN_ROOT",
        "in": [
          "fence"
        ]
      },
      "severity": "breaks",
      "remedy": "Commit the scripts the skill runs into the repository and call them by a repository path, or deliver the plugin as a plugin from the environment's setup script.",
      "fix_in": "plugin",
      "sources": [
        "https://code.claude.com/docs/en/plugins-reference#environment-variables",
        "https://code.claude.com/docs/en/plugins/loading#plugins-shared-through-a-repository"
      ],
      "basis": "docs",
      "checked": "2026-11-01"
    },
    {
      "id": "github-graphql",
      "summary": "GitHub GraphQL is blocked: gh pr, gh issue, gh project, gh repo view, gh label list, gh release list, gh search and gh api graphql get HTTP 403 'GitHub GraphQL is not available from Claude Code sessions'. REST through gh api works.",
      "match": {
        "kind": "command",